[
  {
    "contract_version": "0.2.0",
    "logical_event_id": "logical:tenant-a:app-a:redirector:event:click-10-paid",
    "record_id": "click-10-paid",
    "tenant_id": "tenant-a",
    "app_id": "app-a",
    "producer": "redirector",
    "event_id": "event:click-10-paid",
    "event_name": "click",
    "record_lifecycle": "active",
    "timeliness": "on_time"
  },
  {
    "contract_version": "0.2.0",
    "logical_event_id": "logical:tenant-a:app-a:sdk-android:event:install-10a",
    "record_id": "install-10a",
    "tenant_id": "tenant-a",
    "app_id": "app-a",
    "producer": "sdk-android",
    "event_id": "event:install-10a",
    "event_name": "install",
    "record_lifecycle": "active",
    "timeliness": "on_time"
  },
  {
    "contract_version": "0.2.0",
    "logical_event_id": "logical:tenant-a:app-a:sdk-android:event:install-10b",
    "record_id": "install-10b",
    "tenant_id": "tenant-a",
    "app_id": "app-a",
    "producer": "sdk-android",
    "event_id": "event:install-10b",
    "event_name": "install",
    "record_lifecycle": "active",
    "timeliness": "on_time"
  },
  {
    "contract_version": "0.2.0",
    "logical_event_id": "logical:tenant-a:app-a:sdk-android:event:install-10c",
    "record_id": "install-10c",
    "tenant_id": "tenant-a",
    "app_id": "app-a",
    "producer": "sdk-android",
    "event_id": "event:install-10c",
    "event_name": "install",
    "record_lifecycle": "active",
    "timeliness": "on_time"
  }
]
