[
  {
    "contract_version": "0.2.0",
    "logical_event_id": "logical:tenant-a:app-a:sdk-android:event:skew-exact",
    "record_id": "skew-exact",
    "tenant_id": "tenant-a",
    "app_id": "app-a",
    "producer": "sdk-android",
    "event_id": "event:skew-exact",
    "event_name": "session_start",
    "record_lifecycle": "active",
    "timeliness": "on_time"
  },
  {
    "contract_version": "0.2.0",
    "logical_event_id": "logical:tenant-a:app-a:sdk-android:event:skew-over",
    "record_id": "skew-over",
    "tenant_id": "tenant-a",
    "app_id": "app-a",
    "producer": "sdk-android",
    "event_id": "event:skew-over",
    "event_name": "session_start",
    "record_lifecycle": "active",
    "timeliness": "on_time"
  }
]
