[
  {
    "contract_version": "0.2.0",
    "logical_event_id": "logical:tenant-a:app-a:redirector:event:prefetch-click",
    "record_id": "prefetch-click",
    "tenant_id": "tenant-a",
    "app_id": "app-a",
    "producer": "redirector",
    "event_id": "event:prefetch-click",
    "event_name": "click",
    "record_lifecycle": "active",
    "timeliness": "on_time"
  },
  {
    "contract_version": "0.2.0",
    "logical_event_id": "logical:tenant-a:app-a:sdk-android:event:prefetch-install",
    "record_id": "prefetch-install",
    "tenant_id": "tenant-a",
    "app_id": "app-a",
    "producer": "sdk-android",
    "event_id": "event:prefetch-install",
    "event_name": "install",
    "record_lifecycle": "active",
    "timeliness": "on_time"
  }
]
