[
  {
    "contract_version": "0.2.0",
    "logical_event_id": "logical:tenant-a:app-a:import:synthetic-provider:event:import-install-30",
    "record_id": "import-install-30",
    "tenant_id": "tenant-a",
    "app_id": "app-a",
    "producer": "import:synthetic-provider",
    "event_id": "event:import-install-30",
    "event_name": "install",
    "record_lifecycle": "active",
    "timeliness": "on_time"
  },
  {
    "contract_version": "0.2.0",
    "logical_event_id": "logical:tenant-a:app-a:import:synthetic-provider:event:import-revenue-30",
    "record_id": "import-revenue-30",
    "tenant_id": "tenant-a",
    "app_id": "app-a",
    "producer": "import:synthetic-provider",
    "event_id": "event:import-revenue-30",
    "event_name": "ad_revenue",
    "record_lifecycle": "active",
    "timeliness": "on_time"
  },
  {
    "contract_version": "0.2.0",
    "logical_event_id": "logical:tenant-a:app-a:postback:synthetic-kind:event:postback-revenue-30",
    "record_id": "postback-revenue-30",
    "tenant_id": "tenant-a",
    "app_id": "app-a",
    "producer": "postback:synthetic-kind",
    "event_id": "event:postback-revenue-30",
    "event_name": "ad_revenue",
    "record_lifecycle": "active",
    "timeliness": "on_time"
  }
]
