[
  {
    "contract_version": "0.2.0",
    "logical_event_id": "logical:tenant-a:app-a:import:synthetic-provider:event:aggregate-revenue-33",
    "record_id": "aggregate-revenue-33",
    "tenant_id": "tenant-a",
    "app_id": "app-a",
    "producer": "import:synthetic-provider",
    "event_id": "event:aggregate-revenue-33",
    "event_name": "ad_revenue",
    "record_lifecycle": "active",
    "timeliness": "on_time"
  },
  {
    "contract_version": "0.2.0",
    "logical_event_id": "logical:tenant-a:app-a:import:synthetic-provider:event:install-33",
    "record_id": "install-33",
    "tenant_id": "tenant-a",
    "app_id": "app-a",
    "producer": "import:synthetic-provider",
    "event_id": "event:install-33",
    "event_name": "install",
    "record_lifecycle": "active",
    "timeliness": "on_time"
  },
  {
    "contract_version": "0.2.0",
    "logical_event_id": "logical:tenant-a:app-a:postback:synthetic-view:event:ad-view-33",
    "record_id": "ad-view-33",
    "tenant_id": "tenant-a",
    "app_id": "app-a",
    "producer": "postback:synthetic-view",
    "event_id": "event:ad-view-33",
    "event_name": "ad_view",
    "record_lifecycle": "active",
    "timeliness": "on_time"
  },
  {
    "contract_version": "0.2.0",
    "logical_event_id": "logical:tenant-a:app-a:redirector:event:click-33",
    "record_id": "click-33",
    "tenant_id": "tenant-a",
    "app_id": "app-a",
    "producer": "redirector",
    "event_id": "event:click-33",
    "event_name": "click",
    "record_lifecycle": "active",
    "timeliness": "on_time"
  },
  {
    "contract_version": "0.2.0",
    "logical_event_id": "logical:tenant-a:app-a:sdk-android:event:revenue-33-a",
    "record_id": "revenue-33-a",
    "tenant_id": "tenant-a",
    "app_id": "app-a",
    "producer": "sdk-android",
    "event_id": "event:revenue-33-a",
    "event_name": "ad_revenue",
    "record_lifecycle": "active",
    "timeliness": "on_time"
  },
  {
    "contract_version": "0.2.0",
    "logical_event_id": "logical:tenant-a:app-a:sdk-android:event:revenue-33-b",
    "record_id": "revenue-33-b",
    "tenant_id": "tenant-a",
    "app_id": "app-a",
    "producer": "sdk-android",
    "event_id": "event:revenue-33-b",
    "event_name": "ad_revenue",
    "record_lifecycle": "active",
    "timeliness": "on_time"
  },
  {
    "contract_version": "0.2.0",
    "logical_event_id": "logical:tenant-a:app-a:sdk-android:event:revenue-33-c",
    "record_id": "revenue-33-c",
    "tenant_id": "tenant-a",
    "app_id": "app-a",
    "producer": "sdk-android",
    "event_id": "event:revenue-33-c",
    "event_name": "ad_revenue",
    "record_lifecycle": "active",
    "timeliness": "on_time"
  },
  {
    "contract_version": "0.2.0",
    "logical_event_id": "logical:tenant-a:app-a:sdk-android:event:session-33-d1",
    "record_id": "session-33-d1",
    "tenant_id": "tenant-a",
    "app_id": "app-a",
    "producer": "sdk-android",
    "event_id": "event:session-33-d1",
    "event_name": "session_start",
    "record_lifecycle": "active",
    "timeliness": "on_time"
  },
  {
    "contract_version": "0.2.0",
    "logical_event_id": "logical:tenant-a:app-a:sdk-android:event:session-33-d7",
    "record_id": "session-33-d7",
    "tenant_id": "tenant-a",
    "app_id": "app-a",
    "producer": "sdk-android",
    "event_id": "event:session-33-d7",
    "event_name": "session_start",
    "record_lifecycle": "active",
    "timeliness": "on_time"
  }
]
