[
  {
    "contract_version": "0.2.0",
    "logical_event_id": "logical:tenant-a:app-a:redirector:event:click-4",
    "record_id": "click-4",
    "tenant_id": "tenant-a",
    "app_id": "app-a",
    "producer": "redirector",
    "event_id": "event:click-4",
    "event_name": "click",
    "record_lifecycle": "active",
    "timeliness": "on_time"
  },
  {
    "contract_version": "0.2.0",
    "logical_event_id": "logical:tenant-a:app-a:sdk-android:event:install-after",
    "record_id": "install-after",
    "tenant_id": "tenant-a",
    "app_id": "app-a",
    "producer": "sdk-android",
    "event_id": "event:install-after",
    "event_name": "install",
    "record_lifecycle": "active",
    "timeliness": "on_time"
  },
  {
    "contract_version": "0.2.0",
    "logical_event_id": "logical:tenant-a:app-a:sdk-android:event:install-before",
    "record_id": "install-before",
    "tenant_id": "tenant-a",
    "app_id": "app-a",
    "producer": "sdk-android",
    "event_id": "event:install-before",
    "event_name": "install",
    "record_lifecycle": "active",
    "timeliness": "on_time"
  },
  {
    "contract_version": "0.2.0",
    "logical_event_id": "logical:tenant-a:app-a:sdk-android:event:install-exact",
    "record_id": "install-exact",
    "tenant_id": "tenant-a",
    "app_id": "app-a",
    "producer": "sdk-android",
    "event_id": "event:install-exact",
    "event_name": "install",
    "record_lifecycle": "active",
    "timeliness": "on_time"
  }
]
